{
    "type": "object",
    "properties": {
        "resourceName": {
            "type": "string"
        },
        "bucketName": {
            "type": "string"
        },
        "policyUUID": {
            "type": "string"
        },
        "storageAccess": {
            "enum": [
                "auth",
                "authAndGuest"
            ],
            "type": "string"
        },
        "guestAccess": {
            "type": "array",
            "items": {
                "enum": [
                    "CREATE_AND_UPDATE",
                    "DELETE",
                    "READ"
                ],
                "type": "string"
            }
        },
        "authAccess": {
            "type": "array",
            "items": {
                "enum": [
                    "CREATE_AND_UPDATE",
                    "DELETE",
                    "READ"
                ],
                "type": "string"
            }
        },
        "triggerFunction": {
            "type": "string"
        },
        "groupAccess": {
            "$ref": "#/definitions/GroupAccessType"
        }
    },
    "required": [
        "authAccess",
        "bucketName",
        "guestAccess",
        "policyUUID",
        "resourceName",
        "storageAccess"
    ],
    "definitions": {
        "GroupAccessType": {
            "type": "object"
        }
    },
    "$schema": "http://json-schema.org/draft-07/schema#"
}